[{"bt_run_id":"nfl_games_v1:7244a0bc8ac6","candidate":"C1","g1":false,"g2":false,"g3":true,"g4":true,"brier_status":"not better than market","betting_value_status":"not evaluable: 207 decision-time picks < 400"},{"bt_run_id":"nfl_games_v1:7244a0bc8ac6","candidate":"C2","g1":false,"g2":false,"g3":true,"g4":true,"brier_status":"not better than market","betting_value_status":"not evaluable: 214 decision-time picks < 400"},{"bt_run_id":"nfl_games_v1:7244a0bc8ac6","candidate":"E1","g1":false,"g2":false,"g3":true,"g4":true,"brier_status":"not better than market","betting_value_status":"not evaluable: 200 decision-time picks < 400"},{"bt_run_id":"nfl_games_v1:7244a0bc8ac6","candidate":"B1[C1]","g1":false,"g2":false,"g3":true,"g4":true,"brier_status":"not better than market","betting_value_status":"not evaluable in v1: inputs not known at the opener"},{"bt_run_id":"nfl_games_v1:7244a0bc8ac6","candidate":"B1[C2]","g1":false,"g2":false,"g3":true,"g4":true,"brier_status":"not better than market","betting_value_status":"not evaluable in v1: inputs not known at the opener"},{"bt_run_id":"nfl_games_v1:7244a0bc8ac6","candidate":"B1[E1]","g1":false,"g2":false,"g3":true,"g4":true,"brier_status":"not better than market","betting_value_status":"not evaluable in v1: inputs not known at the opener"},{"bt_run_id":"nfl_games_v1:7244a0bc8ac6","candidate":"B2[E1]","g1":false,"g2":false,"g3":true,"g4":true,"brier_status":"not better than market","betting_value_status":"not evaluable in v1: inputs not known at the opener"},{"bt_run_id":"nfl_games_v1:7244a0bc8ac6","candidate":"K[E1]","g1":false,"g2":false,"g3":true,"g4":true,"brier_status":"not better than market","betting_value_status":"not evaluable: 199 decision-time picks < 400"}]
